{
  "scenario_id": "demo-dangerous-action",
  "run_id": "smoke-001",
  "attempt_index": 1,
  "benchmark_version": "m0-benchmark-freeze-v1",
  "operator": "m0-smoke-script",
  "created_at": "2026-04-15T06:27:26+00:00",
  "model_versions": {
    "supervisor": "supervisor-stub-v1",
    "social": "qwen-placeholder-v1",
    "action": "smolvla-placeholder-v1"
  },
  "device_versions": {
    "robot_arm": "so-arm101-placeholder-v1",
    "wrist_camera": "usb-cam-placeholder-v1",
    "laptop_camera": "builtin-cam-placeholder-v1"
  }
}
